{
  "$schema": "https://json-schema.org/draft/2020-12/schema",
  "$id": "https://hypen.space/schemas/test-case.schema.json",
  "title": "CompatibilityTestCase",
  "description": "A test case for the Hypen engine compatibility test suite",
  "type": "object",
  "properties": {
    "name": {
      "type": "string",
      "description": "Unique identifier for the test case (kebab-case)"
    },
    "description": {
      "type": "string",
      "description": "Human-readable description of what this test verifies"
    },
    "category": {
      "type": "string",
      "enum": ["rendering", "state", "reconciliation", "actions", "control-flow", "lifecycle", "animation", "dnd"],
      "description": "Test category for organization"
    },
    "priority": {
      "type": "string",
      "enum": ["P0", "P1", "P2"],
      "default": "P1",
      "description": "Test priority (P0 = critical, P1 = important, P2 = nice-to-have)"
    },
    "input": {
      "type": "object",
      "properties": {
        "source": {
          "type": "string",
          "description": "Hypen DSL source code to render"
        },
        "initialState": {
          "type": "object",
          "additionalProperties": true,
          "description": "Initial state for the module"
        },
        "module": {
          "type": "object",
          "properties": {
            "name": {
              "type": "string",
              "description": "Module name"
            },
            "actions": {
              "type": "array",
              "items": { "type": "string" },
              "description": "List of action names this module handles"
            },
            "stateKeys": {
              "type": "array",
              "items": { "type": "string" },
              "description": "List of top-level state keys"
            }
          },
          "required": ["name"],
          "additionalProperties": false
        }
      },
      "required": ["source"],
      "additionalProperties": false
    },
    "expected": {
      "type": "object",
      "properties": {
        "patches": {
          "type": "array",
          "items": { "$ref": "patch.schema.json" },
          "description": "Expected patches from initial render"
        },
        "patchCount": {
          "type": "integer",
          "minimum": 0,
          "description": "Expected number of patches (alternative to exact match)"
        },
        "patchTypes": {
          "type": "array",
          "items": { "type": "string" },
          "description": "Expected patch types in exact emission order"
        },
        "strictPatchOrder": {
          "type": "boolean",
          "default": false,
          "description": "When true, `patches` must match the emitted patches index-by-index (exact emission order) instead of structurally. Use for fixtures whose contract IS the ordering, e.g. the flagged-root-first deferred-remove protocol"
        }
      },
      "additionalProperties": false
    },
    "steps": {
      "type": "array",
      "items": {
        "type": "object",
        "properties": {
          "description": {
            "type": "string",
            "description": "Description of this step"
          },
          "action": {
            "type": "string",
            "enum": ["initialRender", "updateState", "dispatchAction", "renderSource", "setViewport"],
            "description": "Type of action to perform"
          },
          "viewport": {
            "type": "object",
            "description": "Visible range to report for a windowed list (for setViewport action), as a renderer would via setListViewport. The list is the first element created so far with `elementType`.",
            "properties": {
              "elementType": { "type": "string" },
              "start": { "type": "integer", "minimum": 0 },
              "end": { "type": "integer", "minimum": 0 }
            },
            "required": ["elementType", "start", "end"],
            "additionalProperties": false
          },
          "source": {
            "type": "string",
            "description": "Replacement Hypen DSL source (for renderSource action) — reconciled against the existing tree, so subtree replacement/teardown paths can be exercised"
          },
          "stateChange": {
            "$ref": "state-change.schema.json",
            "description": "State change to apply (for updateState action)"
          },
          "dispatchAction": {
            "$ref": "action.schema.json",
            "description": "Action to dispatch (for dispatchAction action)"
          },
          "animation": {
            "type": ["object", "string"],
            "description": "Optional batch-animation context for this step's state update (Option D transaction-scoped animation) — applies to updateState steps and to the state update a dispatchAction step's handler produces. Either a spec object (e.g. {\"curve\": \"spring\"}; a missing duration is filled with 250 engine-side) or a bare curve string (\"linear\"|\"easeIn\"|\"easeOut\"|\"easeInOut\"|\"spring\", normalized to {curve, duration: 250}). When the update changes state and emits patches, the engine prepends a batchAnimation patch as the batch's first entry."
          },
          "expectedPatches": {
            "type": "array",
            "items": { "$ref": "patch.schema.json" },
            "description": "Expected patches after this step"
          },
          "expectedPatchCount": {
            "type": "integer",
            "minimum": 0,
            "description": "Expected number of patches (alternative to exact match)"
          },
          "expectedPatchTypes": {
            "type": "array",
            "items": { "type": "string" },
            "description": "Expected patch types in exact emission order"
          },
          "allowExtraPatches": {
            "type": "boolean",
            "default": false,
            "description": "When true, `expectedPatches` need only be a subset of the emitted patches (each matched once). Use when the contract is a few specific patches inside a batch whose rest (e.g. template rows) is not the point of the step"
          },
          "strictPatchOrder": {
            "type": "boolean",
            "default": false,
            "description": "When true, `expectedPatches` must match the emitted patches index-by-index (exact emission order) instead of structurally. Use for steps whose contract IS the ordering, e.g. the flagged-root-first deferred-remove protocol"
          },
          "forbiddenPatchTypes": {
            "type": "array",
            "items": { "type": "string" },
            "description": "Patch types that must NOT appear in this step's emitted patches (e.g. [\"create\", \"remove\"] to pin that an update reconciles in place)"
          },
          "forbiddenPatches": {
            "type": "array",
            "items": {
              "type": "object",
              "properties": {
                "type": {
                  "type": "string",
                  "enum": ["create", "setProp", "setText", "insert", "move", "remove", "attachEvent", "detachEvent"]
                }
              },
              "additionalProperties": true
            },
            "description": "Patch types that must NOT appear"
          },
          "expectedState": {
            "type": "object",
            "additionalProperties": true,
            "description": "Expected state after this step"
          }
        },
        "required": ["action"],
        "additionalProperties": false
      },
      "description": "Multi-step test sequence"
    },
    "skip": {
      "type": "object",
      "properties": {
        "reason": { "type": "string" },
        "sdks": {
          "type": "array",
          "items": { "type": "string" },
          "description": "SDKs to skip this test for (e.g., ['golang'] if not yet implemented)"
        }
      },
      "additionalProperties": false,
      "description": "Skip configuration for this test"
    }
  },
  "required": ["name", "description", "category", "input"],
  "additionalProperties": false
}
